### ISSUE TITLE
Metrics aren't sent to Influx

### ISSUE THREAD

**Issue by EESergey** [minio/warp#420]
I run the test:
```
warp put --host=#REMOVED:9000 --access-key=#REMOVED --secret-key=#REMOVED --insecure --concurrent 1 --duration 60s -obj.size 1MiB --bucket warp01 --noclear --influxdb 'http://#REMOVED@#REMOVED.190:8086/warp/myorg'
```
Warp doesn't stop running after the "Cleanup Done" message, metrics are not sent to Influx.

Warp version: 1.3.0
Influx version: 2.7.12
OS: Ubuntu 22.04.5 LTS
The last version of Warp that didn't have this issue: 1.0.8

From tcpdump I can see that the Post request was not sent:
```
No.     Time           Source                Destination           Protocol Length Info
      1 0.000000       #REMOVED.189          #REMOVED.190          TCP      74     45212 → 8086 [SYN] Seq=0 Win=64240 Len=0 MSS=1460 SACK_PERM TSval=1962444696 TSecr=0 WS=128
      2 0.000044       #REMOVED.190          #REMOVED.189          TCP      74     8086 → 45212 [SYN, ACK] Seq=0 Ack=1 Win=65160 Len=0 MSS=1460 SACK_PERM TSval=641283887 TSecr=1962444696 WS=128
      3 0.000128       #REMOVED.189          #REMOVED.190          TCP      66     45212 → 8086 [ACK] Seq=1 Ack=1 Win=64256 Len=0 TSval=1962444697 TSecr=641283887
      4 0.000259       #REMOVED.189          #REMOVED.190          HTTP     303    GET /ping HTTP/1.1 
      5 0.000271       #REMOVED.190          #REMOVED.189          TCP      66     8086 → 45212 [ACK] Seq=1 Ack=238 Win=65024 Len=0 TSval=641283888 TSecr=1962444697
      6 0.000472       #REMOVED.190          #REMOVED.189          HTTP     205    HTTP/1.1 204 No Content 
      7 0.000508       #REMOVED.189          #REMOVED.190          TCP      66     45212 → 8086 [ACK] Seq=238 Ack=140 Win=64128 Len=0 TSval=1962444697 TSecr=641283888
      8 15.011192      #REMOVED.190          #REMOVED.189          TCP      66     [TCP Keep-Alive] 8086 → 45212 [ACK] Seq=139 Ack=238 Win=65024 Len=0 TSval=641298899 TSecr=1962444697
      9 15.011304      #REMOVED.189          #REMOVED.190          TCP      66     [TCP Keep-Alive ACK] 45212 → 8086 [ACK] Seq=238 Ack=140 Win=64128 Len=0 TSval=1962459708 TSecr=641283888
     10 15.111142      #REMOVED.189          #REMOVED.190          TCP      66     [TCP Keep-Alive] 45212 → 8086 [ACK] Seq=237 Ack=140 Win=64128 Len=0 TSval=1962459808 TSecr=641283888
     11 15.111152      #REMOVED.190          #REMOVED.189          TCP      66     [TCP Keep-Alive ACK] 8086 → 45212 [ACK] Seq=140 Ack=238 Win=65024 Len=0 TSval=641298998 TSecr=1962459708
     12 30.115194      #REMOVED.190          #REMOVED.189          TCP      66     [TCP Keep-Alive] 8086 → 45212 [ACK] Seq=139 Ack=238 Win=65024 Len=0 TSval=641314003 TSecr=1962459708
```

**Comment by klauspost** [comment]
Fix in #421

**Comment by EESergey** [comment]
It works, thanks for the quick solution.
